[
  { "id": "tee_h01", "date": "2026-04-25", "time": "07:00", "courseId": "crs_tournament_loop", "players": ["mbr_acad_riley"],                                            "cart": false, "status": "Completed", "notes": "Pre-tournament solo." },
  { "id": "tee_h02", "date": "2026-04-26", "time": "08:30", "courseId": "crs_academy_loop",    "players": ["mbr_acad_aiden", "mbr_acad_kira"],                           "cart": true,  "status": "Completed", "notes": "Father-daughter weekend round." },
  { "id": "tee_h03", "date": "2026-04-26", "time": "10:00", "courseId": "crs_scoring_nine",    "players": ["mbr_acad_juno"],                                             "cart": false, "status": "Completed", "notes": "Walking, Forward tees." },
  { "id": "tee_h04", "date": "2026-05-02", "time": "09:00", "courseId": "crs_academy_loop",    "players": ["mbr_acad_brian", "mbr_acad_morgan"],                         "cart": false, "status": "Completed", "notes": "Improvement program buddy round." },
  { "id": "tee_h05", "date": "2026-05-03", "time": "14:30", "courseId": "crs_tournament_loop", "players": ["mbr_acad_sasha"],                                            "cart": false, "status": "Completed", "notes": "State Am tune-up." },
  { "id": "tee_h06", "date": "2026-05-09", "time": "08:00", "courseId": "crs_scoring_nine",    "players": ["mbr_acad_kim"],                                              "cart": false, "status": "Completed", "notes": "Walking, short-game focus." },
  { "id": "tee_h07", "date": "2026-05-10", "time": "10:30", "courseId": "crs_academy_loop",    "players": ["mbr_acad_aiden", "mbr_acad_kira"],                           "cart": true,  "status": "Completed", "notes": "Saturday standing tee time." },
  { "id": "tee_h08", "date": "2026-05-15", "time": "16:00", "courseId": "crs_academy_loop",    "players": ["mbr_acad_max"],                                              "cart": true,  "status": "Completed", "notes": "Executive coaching round with Levine. Bill to corporate AR." },
  { "id": "tee_h09", "date": "2026-05-16", "time": "07:30", "courseId": "crs_tournament_loop", "players": ["mbr_acad_riley", "mbr_acad_sasha"],                          "cart": false, "status": "Completed", "notes": "Junior-vs-mid-am competitive practice." },
  { "id": "tee_h10", "date": "2026-05-17", "time": "09:00", "courseId": "crs_scoring_nine",    "players": ["mbr_acad_juno"],                                             "cart": false, "status": "Completed", "notes": "Walking." },

  { "id": "tee_t01", "date": "2026-05-18", "time": "07:00", "courseId": "crs_tournament_loop", "players": ["mbr_acad_riley"],                                            "cart": false, "status": "Completed", "notes": "Early solo." },
  { "id": "tee_t02", "date": "2026-05-18", "time": "07:15", "courseId": "crs_academy_loop",    "players": ["mbr_acad_brian"],                                            "cart": true,  "status": "Completed", "notes": "Walking-cart hybrid; warm-up only on Forge." },
  { "id": "tee_t03", "date": "2026-05-18", "time": "08:00", "courseId": "crs_academy_loop",    "players": ["mbr_acad_morgan", "mbr_acad_kim"],                           "cart": false, "status": "Checked In", "notes": "Member-pair walking round." },
  { "id": "tee_t04", "date": "2026-05-18", "time": "09:30", "courseId": "crs_scoring_nine",    "players": ["mbr_acad_lena"],                                             "cart": false, "status": "Checked In", "notes": "First-ever on-course outing. Pair with Anand for first 3 holes." },
  { "id": "tee_t05", "date": "2026-05-18", "time": "10:15", "courseId": "crs_academy_loop",    "players": ["mbr_acad_juno", "mbr_acad_brian"],                           "cart": true,  "status": "Booked",     "notes": "Cart approved (Juno mobility flag)." },
  { "id": "tee_t06", "date": "2026-05-18", "time": "13:00", "courseId": "crs_tournament_loop", "players": ["mbr_acad_sasha", "mbr_acad_aiden"],                          "cart": false, "status": "Booked",     "notes": "Member match-play prep." },
  { "id": "tee_t07", "date": "2026-05-18", "time": "16:30", "courseId": "crs_scoring_nine",    "players": ["mbr_acad_devin"],                                            "cart": false, "status": "Booked",     "notes": "Junior dev twilight; mom (Sade) escorting." },
  { "id": "tee_t08", "date": "2026-05-18", "time": "17:00", "courseId": "crs_scoring_nine",    "players": ["mbr_acad_aiden", "mbr_acad_kira"],                           "cart": false, "status": "Booked",     "notes": "Twilight family loop." },

  { "id": "tee_n01", "date": "2026-05-19", "time": "07:00", "courseId": "crs_tournament_loop", "players": ["mbr_acad_riley"],                                            "cart": false, "status": "Booked",     "notes": "Tournament-track standing block." },
  { "id": "tee_n02", "date": "2026-05-19", "time": "08:15", "courseId": "crs_academy_loop",    "players": ["mbr_acad_max"],                                              "cart": true,  "status": "Booked",     "notes": "Weekly exec coaching round (Levine)." },
  { "id": "tee_n03", "date": "2026-05-19", "time": "09:00", "courseId": "crs_scoring_nine",    "players": ["mbr_acad_kim"],                                              "cart": false, "status": "Booked",     "notes": "Walking Forge regular." },
  { "id": "tee_n04", "date": "2026-05-19", "time": "10:30", "courseId": "crs_academy_loop",    "players": ["mbr_acad_morgan"],                                           "cart": false, "status": "Booked",     "notes": "Weekday improvement round." },
  { "id": "tee_n05", "date": "2026-05-19", "time": "14:00", "courseId": "crs_tournament_loop", "players": ["mbr_acad_sasha"],                                            "cart": false, "status": "Booked",     "notes": "Solo competitive prep." },
  { "id": "tee_n06", "date": "2026-05-19", "time": "16:00", "courseId": "crs_scoring_nine",    "players": ["mbr_acad_lena"],                                             "cart": false, "status": "Booked",     "notes": "Second-ever round; first 6 holes with coach observation." }
]
